{
  "assumptions": [
    {
      "id": "CALC-R02.EXACT-FINITE-MODEL",
      "node": "boolean",
      "value": true
    }
  ],
  "conclusion": {
    "arguments": [
      {
        "left": {
          "node": "list",
          "values": [
            {
              "node": "cardinality",
              "value": {
                "contexts": [
                  {
                    "entries": [
                      {
                        "key": 1,
                        "value": 1
                      },
                      {
                        "key": 2,
                        "value": 2
                      },
                      {
                        "key": 3,
                        "value": 3
                      },
                      {
                        "key": 4,
                        "value": 4
                      }
                    ],
                    "node": "finite_map"
                  }
                ],
                "domain": {
                  "node": "list",
                  "values": [
                    1,
                    2,
                    3,
                    4
                  ]
                },
                "node": "kernel_partition",
                "observers": [
                  {
                    "entries": [
                      {
                        "key": 1,
                        "value": "A"
                      },
                      {
                        "key": 2,
                        "value": "A"
                      },
                      {
                        "key": 3,
                        "value": "B"
                      },
                      {
                        "key": 4,
                        "value": "C"
                      }
                    ],
                    "node": "finite_map"
                  }
                ]
              }
            },
            {
              "node": "cardinality",
              "value": {
                "domain": {
                  "node": "list",
                  "values": [
                    1,
                    2,
                    3,
                    4
                  ]
                },
                "map": {
                  "entries": [
                    {
                      "key": 1,
                      "value": "A"
                    },
                    {
                      "key": 2,
                      "value": "A"
                    },
                    {
                      "key": 3,
                      "value": "B"
                    },
                    {
                      "key": 4,
                      "value": "C"
                    }
                  ],
                  "node": "finite_map"
                },
                "node": "map_image"
              }
            },
            {
              "domain": {
                "node": "list",
                "values": [
                  1,
                  2,
                  3,
                  4
                ]
              },
              "map": {
                "entries": [
                  {
                    "key": 1,
                    "value": "A"
                  },
                  {
                    "key": 2,
                    "value": "A"
                  },
                  {
                    "key": 3,
                    "value": "B"
                  },
                  {
                    "key": 4,
                    "value": "C"
                  }
                ],
                "node": "finite_map"
              },
              "node": "map_kernel"
            }
          ]
        },
        "node": "equal",
        "right": {
          "node": "list",
          "values": [
            3,
            3,
            [
              [
                1,
                1
              ],
              [
                1,
                2
              ],
              [
                2,
                1
              ],
              [
                2,
                2
              ],
              [
                3,
                3
              ],
              [
                4,
                4
              ]
            ]
          ]
        }
      },
      {
        "left": {
          "node": "list",
          "values": [
            {
              "contexts": [
                {
                  "entries": [
                    {
                      "key": 1,
                      "value": 1
                    },
                    {
                      "key": 2,
                      "value": 2
                    },
                    {
                      "key": 3,
                      "value": 3
                    },
                    {
                      "key": 4,
                      "value": 4
                    }
                  ],
                  "node": "finite_map"
                }
              ],
              "domain": {
                "node": "list",
                "values": [
                  1,
                  2,
                  3,
                  4
                ]
              },
              "node": "kernel_partition",
              "observers": [
                {
                  "entries": [
                    {
                      "key": 1,
                      "value": "A"
                    },
                    {
                      "key": 2,
                      "value": "A"
                    }
                  ],
                  "node": "finite_map"
                }
              ]
            },
            {
              "node": "cardinality",
              "value": {
                "contexts": [
                  {
                    "entries": [
                      {
                        "key": 1,
                        "value": 1
                      },
                      {
                        "key": 2,
                        "value": 2
                      },
                      {
                        "key": 3,
                        "value": 3
                      },
                      {
                        "key": 4,
                        "value": 4
                      }
                    ],
                    "node": "finite_map"
                  }
                ],
                "domain": {
                  "node": "list",
                  "values": [
                    1,
                    2,
                    3,
                    4
                  ]
                },
                "node": "kernel_partition",
                "observers": [
                  {
                    "entries": [
                      {
                        "key": 1,
                        "value": "A"
                      },
                      {
                        "key": 2,
                        "value": "A"
                      }
                    ],
                    "node": "finite_map"
                  }
                ]
              }
            },
            {
              "node": "cardinality",
              "value": {
                "domain": {
                  "node": "list",
                  "values": [
                    1,
                    2,
                    3,
                    4
                  ]
                },
                "map": {
                  "entries": [
                    {
                      "key": 1,
                      "value": "A"
                    },
                    {
                      "key": 2,
                      "value": "A"
                    }
                  ],
                  "node": "finite_map"
                },
                "node": "map_image"
              }
            }
          ]
        },
        "node": "equal",
        "right": {
          "node": "list",
          "values": [
            [
              [
                1,
                2
              ],
              [
                3,
                4
              ]
            ],
            2,
            2
          ]
        }
      }
    ],
    "node": "and"
  },
  "definitions": [
    {
      "english_statement_sha256": "3fa2d68bf74748265f14197fe07806106d77467e1e09263e85add5f7bccdb437",
      "id": "CALC-R02.STATEMENT",
      "node": "statement_correspondence",
      "portuguese_statement_sha256": "6924cb4ed4b6c3a02eae4c85c095a815f83098786dba749586fa27d614878b51"
    },
    {
      "id": "CALC-R02.COMPUTATION.01",
      "node": "list",
      "values": [
        {
          "node": "cardinality",
          "value": {
            "contexts": [
              {
                "entries": [
                  {
                    "key": 1,
                    "value": 1
                  },
                  {
                    "key": 2,
                    "value": 2
                  },
                  {
                    "key": 3,
                    "value": 3
                  },
                  {
                    "key": 4,
                    "value": 4
                  }
                ],
                "node": "finite_map"
              }
            ],
            "domain": {
              "node": "list",
              "values": [
                1,
                2,
                3,
                4
              ]
            },
            "node": "kernel_partition",
            "observers": [
              {
                "entries": [
                  {
                    "key": 1,
                    "value": "A"
                  },
                  {
                    "key": 2,
                    "value": "A"
                  },
                  {
                    "key": 3,
                    "value": "B"
                  },
                  {
                    "key": 4,
                    "value": "C"
                  }
                ],